"Name","Identity","ApplicationInstances","RoutingMethod","DistributionLists","Agents","AgentsInSyncWithDistributionLists","AllowOptOut","AgentsCapped","AgentAlertTime","OverflowThreshold","OverflowAction","OverflowactionTarget","TimeoutActionTarget","OverflowSharedVoicemailTextToSpeechPrompt","OverflowSharedVoicemailAudioFilePrompt","EnableOverflowSharedVoicemailTranscription","TimeoutThreshold","TimeoutAction","TimeoutSharedVoicemailTextToSpeechPrompt","TimeoutSharedVoicemailAudioFilePrompt","EnableTimeoutSharedVoicemailTranscription","WelcomeMusicFileName","UseDefaultMusicOnHold","MusicOnHoldFileName"
"CQ-Accounts","59a5655a-4c42-448e-80ca-3559ada352a8","99754202-0238-4ee1-83da-d8352e34c8bc","Serial","","c7e68a67-57d7-4fce-91de-5d8dbfe5093c, OptIn 6eb7fb1f-bfcf-411a-b76b-cf176642907d, OptIn d68b6ce5-71c7-473f-8027-93f80e38a621, OptIn","True","False","False","15","50","SharedVoicemail",,,"Thank you for holding. Your call is very important to us. 
Unfortunately all of our staff are on other calls. 
Please leave a voicemail with your name and contact number so one of our friendly staff can return your call.",,"False","45","SharedVoicemail","Thank you for holding. Your call is very important to us. 
Unfortunately all of our staff are on other calls. 
Please leave a voicemail with your name and contact number so one of our friendly staff can return your call.",,"False",,"True",
"CQ-Admin","489b6b87-6ce6-47d0-b07b-f5213e24c722","21df9d99-133f-4ddc-a857-23ef72b44514","Attendant","","08e7259a-5268-401b-952c-3a1a7a45a300, OptIn aea979e2-3d54-429d-9f6b-29bb8217bbe2, OptIn c329285a-7d74-467d-91c2-91c9022427df, OptIn 59bcced2-735e-4755-998a-c76220348ef2, OptIn 6fdc108c-5ef9-4b41-8f13-9beb45f0f033, OptIn cceeef3f-cc7d-470d-997c-d3f7c93596b2, OptIn ab1ea981-e109-4fae-9330-6aacb10d0549, OptIn","True","True","False","30","50","DisconnectWithBusy",,,,,"False","30","Forward",,,"False",,"True",
"CQ-Repair Coordinator","ef9ef9f1-7da6-4a4b-b660-15f9a29018da","fb9fb6f3-1eab-4dff-b53a-492ec0afde0c","Attendant","","97390e0f-c208-4fd9-ab19-9a3a4e21f6a9, OptIn debe52c0-29d8-463d-a2ca-55b427e71516, OptIn f39487dd-4243-4038-8568-16976e8fd8b6, OptIn 1bad7744-6dce-4d44-9dad-23367133e7a4, OptIn 6a1f3848-7c97-4444-935a-cac9e2993cc1, OptIn 6f737b31-1e3e-46c7-8b2f-96d970d08c60, OptIn 2acdd767-4dc2-4e5c-be8e-f371fc066a24, OptIn f81361ae-8ab6-4847-adb7-a814b9c0518b, OptIn 2fae38b3-cf70-49a3-91e5-e175fff2f413, OptIn 7976bbe0-eb29-4168-958c-6d8b46f1ca0d, OptIn ad31e189-1efe-4b73-9b54-42037407257a, OptIn","True","True","False","30","50","DisconnectWithBusy",,,,,"False","15","Forward",,,"False",,"True",
